{"allow_commands":true,"budget":{"max_jobs":7,"max_reserved_slot_seconds":200,"max_wall_seconds":120},"name":"Prepare sweep and check","schema_version":"experiment.campaign/0.1","steps":[{"id":"prepare","job":{"argv":["/workspace/scratch/e38cc5b491fa/iteration-04/venv/bin/python3","prepare.py"],"env":{},"inputs":[{"file":"prepare.py","path":"prepare.py"},{"file":"model.json","path":"model.json"}],"limits":{"grace_seconds":1,"wall_seconds":10},"outputs":[{"max_bytes":10000,"name":"model","path":"prepared-model.json","required":true}],"replay":"never","resources":{"cpu_slots":1},"schema_version":"execution.command/0.1"}},{"accept":{"claims":["best_found"],"require_feasible":true},"id":"fcmaes","job":{"inputs":[],"limits":{"grace_seconds":1.0,"wall_time_seconds":30.0},"payload":{"evaluation_limit_mode":"hard","evaluations_per_retry":100,"optimizer":{"kind":"biteopt","parameters":{"population":null}},"problem":{"bounds":{"broadcast":true,"lower":[-5.0],"upper":[5.0]},"config":{"dimension":2},"id":"benchmark.sphere","version":"1"},"retries":1,"seed":1},"payload_schema":"fcmaes.retry/1","resources":{"cpu_slots":1,"inner_threads":1,"outer_workers":1},"schema_version":"optimization.job/0.1","worker":"fcmaes"},"matrix":{"/payload/seed":[1,2,3]},"needs":["prepare"]},{"accept":{"claims":["numerical_optimum"],"require_feasible":true},"id":"lp-ip","job":{"inputs":[{"from":{"kind":"output","output":"model","step":"prepare"},"name":"model"}],"limits":{"grace_seconds":1.0,"wall_time_seconds":30.0},"payload":{"feasibility_tolerance":1e-07,"integrality_tolerance":1e-07,"iteration_limit":10000,"model_input":"model","node_limit":1000,"presolve":true,"starts":[null]},"payload_schema":"lp-ip.solve/1","resources":{"cpu_slots":1,"inner_threads":1,"outer_workers":1},"schema_version":"optimization.job/0.1","worker":"lp-ip"},"needs":["prepare"]},{"accept":{"claims":["first_order"],"require_feasible":true},"id":"sqp","job":{"inputs":[],"limits":{"grace_seconds":1.0,"wall_time_seconds":30.0},"payload":{"backend":"active_set","dimension":4,"feasibility_tolerance":1e-07,"max_callback_calls":2000,"max_iterations":100,"problem":"benchmark.simplex","starts":[[0.1,0.2,0.3,0.4]],"stationarity_tolerance":1e-06},"payload_schema":"sqp.solve/1","resources":{"cpu_slots":1,"inner_threads":1,"outer_workers":1},"schema_version":"optimization.job/0.1","worker":"sqp"},"needs":["prepare"]},{"id":"check","job":{"argv":["/workspace/scratch/e38cc5b491fa/iteration-04/venv/bin/python3","check.py"],"env":{},"inputs":[{"file":"check.py","path":"check.py"},{"from":{"kind":"native","step":"lp-ip"},"path":"lp.json"},{"from":{"kind":"native","step":"sqp"},"path":"sqp.json"}],"limits":{"grace_seconds":1,"wall_seconds":10},"outputs":[{"max_bytes":10000,"name":"checks","path":"checks.json","required":true}],"replay":"never","resources":{"cpu_slots":1},"schema_version":"execution.command/0.1"},"needs":["fcmaes","lp-ip","sqp"]}]}
